{
  "$schema": "https://json-schema.org/draft/2020-12/schema",
  "$id": "https://lagovista.com/schemas/auth-model/linear-user-behavior-v2.schema.json",
  "title": "Linear User Behavior",
  "type": "object",
  "additionalProperties": false,
  "required": [
    "$schema",
    "schemaVersion",
    "key",
    "name",
    "summary",
    "version",
    "maturity",
    "progress",
    "categoryKey",
    "scenarioKeys",
    "finalOutcome",
    "supportedPlatforms",
    "sourceReferences"
  ],
  "properties": {
    "$schema": {
      "type": "string"
    },
    "schemaVersion": {
      "const": "2.0"
    },
    "key": {
      "type": "string",
      "pattern": "^auth\\.behavior\\.[a-z][a-z0-9-]{1,63}(\\.[a-z][a-z0-9-]{1,63})*$"
    },
    "name": {
      "type": "string",
      "minLength": 1
    },
    "summary": {
      "type": "string",
      "minLength": 1
    },
    "version": {
      "type": "integer",
      "minimum": 1
    },
    "maturity": {
      "enum": [
        "proposed",
        "reviewed",
        "approved",
        "implemented",
        "verified",
        "deprecated"
      ]
    },
    "categoryKey": {
      "type": "string",
      "maxLength": 64,
      "pattern": "^[a-z][a-z0-9]*(?:-[a-z0-9]+)+$",
      "description": "Behavior family in subject-action form, such as passkey-sign-in, password-recovery, or invitation-acceptance."
    },
    "scenarioKeys": {
      "type": "array",
      "items": {
        "type": "string",
        "pattern": "^auth\\.scenario\\."
      },
      "description": "Ordered decomposition into atomic scenarios. May be empty while behavior-first reconciliation is still defining downstream requirements."
    },
    "entryViewKey": {
      "$ref": "#/$defs/optionalViewKey"
    },
    "finalViewKey": {
      "$ref": "#/$defs/optionalViewKey"
    },
    "finalOutcome": {
      "type": "string",
      "minLength": 1
    },
    "supportedPlatforms": {
      "type": "array",
      "uniqueItems": true,
      "items": {
        "enum": [
          "server",
          "web",
          "android",
          "ios",
          "vtm"
        ]
      }
    },
    "sourceReferences": {
      "type": "array",
      "items": {
        "type": "object",
        "additionalProperties": false,
        "required": [
          "sourceType",
          "reference"
        ],
        "properties": {
          "sourceType": {
            "enum": [
              "ddr",
              "code",
              "test",
              "discussion",
              "decision",
              "auth-view",
              "journey",
              "external"
            ]
          },
          "reference": {
            "type": "string",
            "minLength": 1
          },
          "section": {
            "type": "string"
          },
          "commit": {
            "type": "string"
          },
          "note": {
            "type": "string"
          }
        }
      }
    },
    "definitionHash": {
      "type": "string",
      "pattern": "^[a-f0-9]{64}$"
    },
    "progress": {
      "$ref": "auth-reconciliation-progress.schema.json#/$defs/behaviorProgress",
      "description": "Tracks reviewed downstream reconciliation phases for this behavior."
    }
  },
  "$defs": {
    "viewKey": {
      "type": "string",
      "pattern": "^(auth|app)\\.[a-z][a-z0-9-]{1,63}(\\.[a-z][a-z0-9-]{1,63})*$"
    },
    "optionalViewKey": {
      "anyOf": [
        {
          "$ref": "#/$defs/viewKey"
        },
        {
          "type": "null"
        }
      ]
    }
  }
}
