{
  "$schema": "../schemas/linear-user-behavior-v2.schema.json",
  "schemaVersion": "2.0",
  "key": "auth.behavior.totp.enrollment-success",
  "name": "TOTP Enrollment Success",
  "summary": "An authenticated user explicitly begins time-based one-time password enrollment, configures an authenticator from the returned enrollment material, confirms possession with one valid generated code, enables MFA, and receives recovery codes on a dedicated destination view.",
  "version": 2,
  "maturity": "proposed",
  "categoryKey": "totp-enrollment",
  "scenarioKeys": [
    "auth.scenario.totp-enrollment.start-to-enroll",
    "auth.scenario.totp-enrollment.enroll-to-confirm",
    "auth.scenario.totp-enrollment.confirm-to-recovery-codes"
  ],
  "entryViewKey": "auth.mfa.totp.start",
  "finalViewKey": "auth.mfa.totp.recovery-codes",
  "finalOutcome": "TOTP is enabled for the current durable identity, the authenticator secret is stored securely, and a fresh set of recovery codes is displayed to the user on the dedicated recovery-code surface.",
  "supportedPlatforms": ["server", "web", "android", "ios"],
  "sourceReferences": [
    {
      "sourceType": "code",
      "reference": "src/LagoVista.UserAdmin/Managers/AppUserMfaManager.cs",
      "note": "BeginTotpEnrollmentAsync and ConfirmTotpEnrollmentAsync are modeled as two distinct server operations in separate scenarios."
    },
    {
      "sourceType": "auth-view",
      "reference": "auth.mfa.totp.start",
      "note": "Explicit user-facing entry point for the begin-enrollment operation."
    },
    {
      "sourceType": "auth-view",
      "reference": "auth.mfa.totp.enroll",
      "note": "Displays QR code and secret returned by successful begin enrollment."
    },
    {
      "sourceType": "auth-view",
      "reference": "auth.mfa.totp.confirm",
      "note": "Collects the single verification code used by the confirmation server operation."
    },
    {
      "sourceType": "auth-view",
      "reference": "auth.mfa.totp.recovery-codes",
      "note": "Dedicated destination surface for recovery codes returned by successful confirmation."
    },
    {
      "sourceType": "test",
      "reference": "auth.test-binding.totp-enrollment.success",
      "note": "Authored server proof exercises the real AuthenticationFlowService, typed begin/confirm handlers and AppUserMfaManager, including generation of a real current TOTP from the staged secret."
    },
    {
      "sourceType": "decision",
      "reference": "ChatGPT conversation 2026-08-19",
      "note": "Canonical enrollment uses simple stable screens rather than mutating one screen through workflow states. The only remaining authored implementation gap is the React Native enrollment view's placeholder QR renderer; UI runtime execution remains a separate later phase."
    }
  ],
  "progress": {
    "scenarios": "complete",
    "presentation": "complete",
    "implementation": "in-progress",
    "tests": "complete"
  }
}
