{
  "$schema": "../schemas/linear-user-behavior-v2.schema.json",
  "schemaVersion": "2.0",
  "key": "auth.behavior.password.sign-in-mfa-selection-required",
  "name": "Password Sign-In MFA Selection Required",
  "summary": "A user enters through password sign-in, submits valid credentials for an identity that has both TOTP and Passkey available, and is handed off to Select MFA Type before completing the second factor.",
  "version": 1,
  "maturity": "proposed",
  "categoryKey": "password-sign-in",
  "scenarioKeys": [
    "auth.scenario.password-sign-in.welcome-to-email-entry",
    "auth.scenario.password-sign-in.email-entry-to-password-entry",
    "auth.scenario.password-sign-in.password-entry-sign-in-mfa-selection-required"
  ],
  "entryViewKey": "auth.welcome",
  "finalViewKey": "auth.select.mfa-type",
  "finalOutcome": "The password proof is accepted, no authenticated application session is issued yet, and the user is presented with both available MFA methods.",
  "supportedPlatforms": ["server", "web", "android", "ios"],
  "sourceReferences": [
    { "sourceType": "code", "reference": "src/LagoVista.UserAdmin/Authentication/Flows/PasswordLoginFlowHandler.cs", "note": "The server returns the generic MFA-required outcome with both enrolled methods in availableMfaProviders." },
    { "sourceType": "code", "reference": "softwarelogistics/nuviot-ui-shared:user/email-login-password/email-login-password.component.ts", "note": "Angular Web routes a response containing both TOTP and Passkey to AuthRoutes.selectMfaType." },
    { "sourceType": "code", "reference": "nuviot/vtm-client:src/platform/auth/auth-context.tsx", "note": "React Native recognizes both available MFA methods before session persistence and returns the mfa-select outcome." },
    { "sourceType": "code", "reference": "nuviot/vtm-client:src/features/authentication/nuviot-account/screens/continue-email-password-screen.tsx", "note": "React Native routes mfa-select to /auth/select/mfa/type." },
    { "sourceType": "auth-view", "reference": "auth.select.mfa-type", "note": "Canonical destination for the both-MFA-methods password sign-in outcome." },
    { "sourceType": "decision", "reference": "auth-model/CLIENT-RESPONSE-ROUTING.md", "note": "Multiple supported MFA providers route to auth.select.mfa-type rather than selecting a factor automatically." }
  ],
  "progress": { "scenarios": "complete", "presentation": "complete", "implementation": "complete", "tests": "complete" }
}
