{
  "$schema": "../schemas/linear-user-behavior-v2.schema.json",
  "schemaVersion": "2.0",
  "key": "auth.behavior.totp.sign-in-success",
  "name": "TOTP Sign-In Success",
  "summary": "A returning user whose durable account has already been identified supplies a valid time-based one-time authenticator code and establishes an authenticated application session through the TOTP continuation path.",
  "version": 1,
  "maturity": "proposed",
  "categoryKey": "totp-sign-in",
  "scenarioKeys": [
    "auth.scenario.totp-sign-in.verify-success"
  ],
  "entryViewKey": "auth.continue.totp",
  "finalViewKey": "app.home",
  "finalOutcome": "The submitted TOTP proof is accepted for the existing durable identity and an authenticated application session is active.",
  "supportedPlatforms": [
    "server",
    "web",
    "android",
    "ios"
  ],
  "sourceReferences": [
    {
      "sourceType": "code",
      "reference": "src/LagoVista.UserAdmin/Authentication/Flows/TotpAuthenticationFlowHandler.cs",
      "note": "Typed handler resolves the durable identity and delegates TOTP proof validation to the real AppUserMfaManager."
    },
    {
      "sourceType": "code",
      "reference": "src/LagoVista.UserAdmin/Authentication/AuthenticationFlowService.cs",
      "note": "Stable browser and mobile entry points adapt the same accepted TOTP proof into the appropriate application session model."
    },
    {
      "sourceType": "test",
      "reference": "auth.test-binding.totp-sign-in",
      "note": "Real-path integration proof covers valid TOTP verification and session establishment without mocking the MFA/domain operation."
    },
    {
      "sourceType": "code",
      "reference": "nuviot/nuvos-app-contracts:generated/auth/client.ts",
      "note": "Generated createTotpLogin and createTotpToken operations provide the stable client contracts consumed by Angular and React Native."
    }
  ],
  "progress": {
    "scenarios": "complete",
    "presentation": "complete",
    "implementation": "complete",
    "tests": "complete"
  }
}
