{
  "$schema": "../schemas/linear-user-behavior-v2.schema.json",
  "schemaVersion": "2.0",
  "key": "auth.behavior.email-verification.success",
  "name": "Email Verification Success",
  "summary": "An unverified durable user requests an email-verification code, submits the valid current proof, and proves control of the email address.",
  "version": 3,
  "maturity": "reviewed",
  "categoryKey": "email-verification",
  "scenarioKeys": [
    "auth.scenario.email-verification.success.send-code",
    "auth.scenario.email-verification.success.verify-code"
  ],
  "entryViewKey": "auth.email-verification.send",
  "finalViewKey": "auth.email-verification.confirmed",
  "finalOutcome": "Email ownership is verified for the current durable identity and the verification proof cannot be reused.",
  "supportedPlatforms": ["server", "web", "android", "ios"],
  "sourceReferences": [
    { "sourceType": "code", "reference": "src/LagoVista.UserAdmin/Managers/UserVerficationManager.cs" },
    { "sourceType": "decision", "reference": "ChatGPT conversation 2026-08-13", "note": "Behaviors are lightweight start-to-end documentation constructs. Scenarios are behavior-owned atomic UI-test steps and are not reused across behaviors." }
  ],
  "progress": {
    "scenarios": "complete",
    "presentation": "complete",
    "implementation": "complete",
    "tests": "complete"
  }
}
