{
  "$schema": "../schemas/linear-user-behavior-v2.schema.json",
  "schemaVersion": "2.0",
  "key": "auth.behavior.password.sign-in-passkey-required",
  "name": "Password Sign-In Passkey Required",
  "summary": "A user enters through Welcome, chooses email authentication, submits valid password credentials for an identity that requires passkey proof, receives the generic MFA-required server outcome with provider=passkey, and the client routes to the existing Passkey Sign In flow.",
  "version": 1,
  "maturity": "proposed",
  "categoryKey": "password-sign-in",
  "scenarioKeys": [
    "auth.scenario.password-sign-in.welcome-to-email-entry",
    "auth.scenario.password-sign-in.email-entry-to-password-entry",
    "auth.scenario.password-sign-in.password-entry-sign-in-passkey-required"
  ],
  "entryViewKey": "auth.welcome",
  "finalViewKey": "auth.continue.passkey",
  "finalOutcome": "The password proof is accepted, no authenticated application session is issued yet, and client response routing places the user on the canonical passkey continuation surface; the existing Passkey Sign In category owns the remaining ceremony.",
  "supportedPlatforms": ["server", "web", "android", "ios"],
  "sourceReferences": [
    { "sourceType": "auth-view", "reference": "auth.continue.passkey", "note": "Canonical Passkey Sign In entry surface already exists and is implemented on both stable clients." },
    { "sourceType": "decision", "reference": "auth-model/CLIENT-RESPONSE-ROUTING.md", "note": "provider=passkey routing is a client presentation obligation and does not create a separate server transition or C# flow proof obligation." },
    { "sourceType": "code", "reference": "src/LagoVista.AspNetCore.Identity/Managers/SigninManager.cs", "note": "Current password RequiresTwoFactor handling only returns provider=totp; provider=passkey selection remains an implementation gap and is not claimed complete by this behavior." }
  ],
  "progress": { "scenarios": "complete", "presentation": "complete", "implementation": "in-progress", "tests": "complete" }
}
