{
  "$schema": "../schemas/linear-user-behavior-v2.schema.json",
  "schemaVersion": "2.0",
  "key": "auth.behavior.password.change-success",
  "name": "Password Change Success",
  "summary": "An authenticated user proves the current password and replaces it with a valid new password for the same durable identity.",
  "version": 1,
  "maturity": "proposed",
  "categoryKey": "password-management",
  "scenarioKeys": [],
  "finalOutcome": "The password credential for the current durable identity has been replaced and the user remains the same identity.",
  "supportedPlatforms": [
    "server",
    "web",
    "android",
    "ios"
  ],
  "sourceReferences": [
    {
      "sourceType": "code",
      "reference": "src/LagoVista.UserAdmin/Managers/PasswordManager.cs",
      "note": "ChangePasswordAsync provides the existing credential-replacement implementation."
    }
  ],
  "progress": {
    "scenarios": "not-started",
    "presentation": "not-started",
    "implementation": "not-started",
    "tests": "not-started"
  }
}
