{
  "$schema": "../schemas/linear-user-behavior-v2.schema.json",
  "schemaVersion": "2.0",
  "key": "auth.behavior.password-recovery.success",
  "name": "Password Recovery Success",
  "summary": "An anonymous user starts from password sign-in, requests recovery for an email address, proves possession of that email with a six-digit code, establishes a new password, and returns to password sign-in.",
  "version": 1,
  "maturity": "proposed",
  "categoryKey": "password-recovery",
  "scenarioKeys": [],
  "entryViewKey": "auth.continue.email.password",
  "finalViewKey": "auth.continue.email.password",
  "finalOutcome": "The recovery code has been successfully verified and consumed, the password credential has been replaced, and the anonymous user can sign in with the new password.",
  "supportedPlatforms": [
    "server",
    "web",
    "android",
    "ios"
  ],
  "sourceReferences": [
    {
      "sourceType": "code",
      "reference": "src/LagoVista.UserAdmin/Managers/PasswordManager.cs",
      "note": "Six-digit recovery code generation, verification, consumption, and final password reset behavior."
    },
    {
      "sourceType": "code",
      "reference": "src/LagoVista.UserAdmin/Authentication/Flows/PasswordRecoveryVerificationFlowHandler.cs",
      "note": "Canonical recovery verification transition."
    },
    {
      "sourceType": "discussion",
      "reference": "ChatGPT conversation 2026-08-08",
      "note": "Behavior-first reconciliation of the six-digit password recovery flow."
    }
  ],
  "progress": {
    "scenarios": "not-started",
    "presentation": "not-started",
    "implementation": "not-started",
    "tests": "not-started"
  }
}
