{
  "$schema": "../schemas/linear-user-behavior-v2.schema.json",
  "schemaVersion": "2.0",
  "key": "auth.behavior.password.sign-in-locked-out",
  "name": "Password Sign-In Locked Out",
  "summary": "A user enters through Welcome, chooses email authentication, submits password credentials for an account that is currently locked out, and receives a lockout-specific outcome without establishing a session.",
  "version": 1,
  "maturity": "proposed",
  "categoryKey": "password-sign-in",
  "scenarioKeys": [
    "auth.scenario.password-sign-in.welcome-to-email-entry",
    "auth.scenario.password-sign-in.email-entry-to-password-entry",
    "auth.scenario.password-sign-in.password-entry-sign-in-locked-out"
  ],
  "entryViewKey": "auth.welcome",
  "finalViewKey": "auth.sign-in.unable",
  "finalOutcome": "No authenticated session is established and the user receives a lockout-specific outcome that can drive recovery or support guidance.",
  "supportedPlatforms": [
    "server",
    "web",
    "android",
    "ios"
  ],
  "sourceReferences": [
    {
      "sourceType": "code",
      "reference": "src/LagoVista.AspNetCore.Identity/Managers/SigninManager.cs",
      "note": "PasswordSignInAsync treats SignInResult.IsLockedOut as a distinct branch and returns AuthUserLockedOut while recording PasswordAuthenticationFailed."
    },
    {
      "sourceType": "decision",
      "reference": "ChatGPT conversation 2026-08-09",
      "note": "Scenario reconciliation assigns locked-out password submission to its own canonical outcome while reusing the shared pre-submit navigation steps."
    }
  ],
  "progress": {
    "scenarios": "complete",
    "presentation": "not-started",
    "implementation": "not-started",
    "tests": "not-started"
  }
}
